{
  "packet_id": "s13-propose-resource-config-secrets",
  "completed_at": "2026-03-21T14:53:31Z",
  "completed_by": { "kind": "agent", "id": "claude-opus-4.6" },
  "summary": "BACKFILLED — completion not recorded contemporaneously. Wired remaining 6 ProposalChange kinds to CLI propose subcommands: set fs-roots, set net-allowlist, set exec-root, set secret, set secret-mode, delete secret. Added --secret-value and --secret-passphrase to the approve command for P5 redaction flow. Completes IOME feature slice: all modules configurable and invocable via CLI. Verified from git commit b8b11e1 (2026-03-20T07:53:31-07:00).",
  "files_changed": [
    "factory/packets/s13-propose-resource-config-secrets.json",
    "packages/cli/src/commands/propose.ts",
    "packages/cli/src/commands/proposals.ts"
  ],
  "verification": {
    "tests_pass": true,
    "build_pass": true,
    "lint_pass": true,
    "ci_pass": true,
    "notes": "Backfilled from verified implemented state. Pre-commit hook (build+lint+factory:validate) passed at commit time. No new tests (CLI command wiring only; underlying ProposalQueue already has 48 tests). Commit timestamp used as completed_at."
  }
}
