{
  "packet_id": "p10-factory-workflow-activation",
  "completed_at": "2026-03-21T14:27:13.406Z",
  "completed_by": {
    "kind": "agent",
    "id": "claude-opus-4.6"
  },
  "summary": "Implemented P10.1 (commit-time completion gate, FI-7) and P10.2 (factory:status session reconstruction command). Completion gate: evaluateCompletionGate() pure function blocks commits with non-factory implementation files when any started packet lacks completion. Pre-commit hook wired. Status command: deriveFactoryStatus() pure function reconstructs workflow state from artifacts and identifies next legal action. 28 factory tests (16 gate + 12 status). factory:test, factory:status, factory:validate scripts added.",
  "files_changed": [
    ".githooks/pre-commit",
    "factory/README.md",
    "factory/acceptances/p9-factory-integrity-enforcement.json",
    "factory/acceptances/s1-dsl-implementation.json",
    "factory/acceptances/s10-execution-wiring.json",
    "factory/acceptances/s11-exec-module.json",
    "factory/acceptances/s5-acceptance-integration.json",
    "factory/acceptances/s6-composition-graph-infrastructure.json",
    "factory/acceptances/s7-authority-bounding-composition.json",
    "factory/acceptances/s8-provider-dependency-model.json",
    "factory/acceptances/s9-runtime-host-adapter-completion.json",
    "package.json"
  ],
  "verification": {
    "tests_pass": true,
    "build_pass": true,
    "lint_pass": true,
    "ci_pass": true,
    "notes": "All verification passed. build, lint, tests — all green."
  }
}
