{
  "packet_id": "s10-execution-wiring",
  "completed_at": "2026-03-20T00:04:18Z",
  "completed_by": { "kind": "agent", "id": "claude-opus-4.6" },
  "summary": "BACKFILLED — completion not recorded contemporaneously. Wired end-to-end execution path: registered concrete handlers (filesystem x4, anthropic x1), wired all kernel adapters (fs, exec, network, secrets) in both CLI and Desktop. Created CLI 'archon execute' command and Desktop 'kernel:execute' IPC handler. Uses ExecutionGate directly per-call since ProjectRuntime.executionSurface is immutable post-construction. Verified from git commit 60b7463 (2026-03-19T17:04:18-07:00).",
  "files_changed": [
    "factory/packets/s10-execution-wiring.json",
    "packages/cli/package.json",
    "packages/cli/src/commands/demo.ts",
    "packages/cli/src/commands/execute.ts",
    "packages/cli/src/commands/index.ts",
    "packages/cli/tsconfig.json",
    "packages/desktop/package.json",
    "packages/desktop/src/main/index.ts",
    "packages/desktop/tsconfig.json",
    "pnpm-lock.yaml"
  ],
  "verification": {
    "tests_pass": true,
    "build_pass": true,
    "lint_pass": true,
    "ci_pass": true,
    "notes": "Backfilled from verified implemented state. Pre-commit hook (build+lint+factory:validate) passed at commit time. 11/11 packages build. 618 tests pass. Commit timestamp used as completed_at."
  }
}
