{
  "packet_id": "v01-openai-provider-qa",
  "completed_at": "2026-03-26T14:28:38.456Z",
  "completed_by": {
    "kind": "agent",
    "id": "claude-qa"
  },
  "summary": "QA PASS: All 14 OAI-U tests verify correct OpenAI Chat Completions integration. URL, Bearer auth, request body, response parsing, error handling all verified.",
  "files_changed": [
    "completions/v01-google-provider.json",
    "completions/v01-openai-provider.json",
    "modules/providers/google/package.json",
    "modules/providers/google/src/execute.ts",
    "modules/providers/google/src/index.ts",
    "modules/providers/google/test/google-provider.test.ts",
    "modules/providers/openai/package.json",
    "modules/providers/openai/src/execute.ts",
    "modules/providers/openai/src/index.ts",
    "modules/providers/openai/test/openai-provider.test.ts",
    "packages/cli/package.json",
    "packages/cli/src/commands/demo.ts",
    "packages/desktop/package.json",
    "packages/desktop/src/main/index.ts",
    "packets/v01-decision-log-viewer.json",
    "packets/v01-google-provider-qa.json",
    "packets/v01-google-provider.json",
    "packets/v01-openai-provider-qa.json",
    "packets/v01-openai-provider.json",
    "pnpm-lock.yaml"
  ],
  "verification": {
    "tests_pass": true,
    "build_pass": true,
    "lint_pass": true,
    "ci_pass": true,
    "notes": "All verification passed. build, lint, tests — all green."
  }
}
