{
  "packet_id": "s3-module-loading-pipeline",
  "completed_at": "2026-03-18T19:00:00Z",
  "completed_by": {
    "kind": "agent",
    "id": "claude-opus-4-6"
  },
  "summary": "Implemented ModuleValidator.validateManifest() with full structural and semantic validation: required fields, semver, capability type taxonomy (I7), default_enabled false (I1), params_schema shape, intrinsic restriction strings, hazard declaration types. Implemented ModuleLoader.load() pipeline: validate → hash verify (skip empty for dev mode, SHA-256 verify for non-empty) → DSL validation via compileDSL → success return. Added computeManifestHash() with deterministic canonical JSON. 32 new tests (20 validator + 12 loader). 127 module-loader tests total, all passing.",
  "files_changed": [
    "packages/module-loader/src/validator.ts",
    "packages/module-loader/src/loader.ts",
    "packages/module-loader/src/index.ts",
    "packages/module-loader/test/validator.test.ts",
    "packages/module-loader/test/loader.test.ts"
  ],
  "verification": {
    "tests_pass": true,
    "build_pass": true,
    "lint_pass": true,
    "ci_pass": true,
    "notes": "127 module-loader tests (32 new). Zero regressions."
  }
}
